uid,title,abstract,year,venue,authors,doi,arxiv_id,url,source,query,query_role,family,advisor_seed,citation_count,matched_terms,retrieved_at,relevance_score,hostile_score
doi:10.1049/csy2.70051,SCU‐T‐MPC: Risk‐Aware and Socially Compliant Topological Motion Planning Under Uncertainty,"ABSTRACT Topology‐driven model predictive control (T‐MPC) has demonstrated significant performance in navigating dynamic environments by planning trajectories in distinct homotopy classes in parallel. However, its performance is limited by deterministic assumptions about obstacle motions and a cost function that ignores social norms. This paper presents a unified framework, socially compliant topology‐driven model predictive control under uncertainty (SCU‐T‐MPC) that addresses these limitations. First, we introduce the concept of probabilistic homotopy classes by integrating multi‐modal uncertainty into the topological guidance planner, enabling robustness to various potential futures. Second, we formulate a risk‐aware parallel optimisation scheme where each local planner incorporates chance constraints and a risk‐adjusted cost. Finally, we learn a social preference model from human demo",2026,IET Cyber-Systems and Robotics,Bo Ye; Zhigang Ren,10.1049/csy2.70051,,https://doi.org/10.1049/csy2.70051,crossref,task and motion planning robotics,anti_myopia,classic,,,model predictive control; motion planning; task and motion planning; human demonstration; limitation; robustness,2026-06-12T15:07:36Z,11.900,19.900
doi:10.1109/icrms.2018.00071,Failure Mechanisms Cumulative Model for Reliability Evaluation of k-Out-of-n System with Different Types of Failure Mechanisms,,2018,"2018 12th International Conference on Reliability, Maintainability, and Safety (ICRMS)",Xiaoyong Yu; Ying Chen,10.1109/icrms.2018.00071,,https://doi.org/10.1109/icrms.2018.00071,crossref,robot world model failure,anti_myopia,anti_thesis,,,robot world model; robot world model failure,2026-06-12T15:07:36Z,14.800,19.800
doi:10.1142/s2972335324500029,Consolidating Trees of Robotic Plans Generated Using Large Language Models to Improve Reliability,"The inherent probabilistic nature of Large Language Models (LLMs) introduces an element of unpredictability, raising concerns about potential discrepancies in their output. This paper presents a novel approach designed to generate correct and optimal robotic task plans for diverse real-world demands and scenarios. LLMs have been used to generate task plans, but they are unreliable and may contain wrong, questionable, or high-cost steps. The proposed approach uses LLM to generate a number of task plans as trees and amalgamates them into a graph by removing questionable paths. Then an optimal task tree can be retrieved to circumvent questionable and high-cost nodes, thereby improving planning accuracy and execution efficiency. The approach is further improved by incorporating a large knowledge network. Leveraging GPT-4 further, the high-level task plan is converted into a low-level Plannin",2024,International Journal of Artificial Intelligence and Robotics Research,Md Sadman Sakib; Yu Sun,10.1142/s2972335324500029,,https://doi.org/10.1142/s2972335324500029,crossref,large language model limitation robot planning,anti_myopia,anti_thesis,,8,limitation; large language model limitation robot planning,2026-06-12T15:07:36Z,14.799,19.799
doi:10.1007/s13369-025-10887-3,"A Comprehensive Review of Neuro-symbolic AI for Robustness, Uncertainty Quantification, and Intervenability","Abstract As Artificial Intelligence (AI) systems are increasingly deployed in high-stakes domains such as healthcare, autonomous systems, finance, and critical infrastructure, ensuring their trustworthiness has become imperative. This paper presents a comprehensive survey of neuro-symbolic AI, a hybrid paradigm that combines the learning capabilities of neural networks with the reasoning strengths of symbolic AI, through the lens of three foundational dimensions: robustness, uncertainty quantification (UQ), and intervenability. We first establish the limitations of purely data-driven “black-box” models in handling distribution shifts, ambiguous inputs, and human oversight. In contrast, neuro-symbolic systems offer enhanced interpretability, verifiability, and control, making them promising candidates for real-world deployment. We systematically review state-of-the-art techniques for mode",2026,Arabian Journal for Science and Engineering,Kamal Acharya; Houbing Song,10.1007/s13369-025-10887-3,,https://doi.org/10.1007/s13369-025-10887-3,crossref,neuro symbolic robot planning,concept,architecture,,7,neuro symbolic robot planning; limitation; robustness; distribution shift; deployment,2026-06-12T15:07:36Z,14.690,19.690
doi:10.1609/aaai.v40i8.37583,Any-Optical-Model: A Universal Foundation Model for Optical Remote Sensing,"Optical satellites, with their diverse band layouts and ground sampling distances, supply indispensable evidence for tasks ranging from ecosystem surveillance to emergency response. However, significant discrepancies in band composition and spatial resolution across different optical sensors present major challenges for existing Remote Sensing Foundation Models (RSFMs). These models are typically pretrained on fixed band configurations and resolutions, making them vulnerable to real world scenarios involving missing bands, cross sensor fusion, and unseen spatial scales, thereby limiting their generalization and practical deployment. To address these limitations, we propose Any Optical Model (AOM), a universal RSFM explicitly designed to accommodate arbitrary band compositions, sensor types, and resolution scales. To preserve distinctive spectral characteristics even when bands are missin",2026,Proceedings of the AAAI Conference on Artificial Intelligence,Xuyang Li; Chenyu Li; Danfeng Hong,10.1609/aaai.v40i8.37583,,https://doi.org/10.1609/aaai.v40i8.37583,crossref,robot foundation model failure mode,hostile,failure,,,robot foundation model; failure mode; limitation; generalization; deployment,2026-06-12T15:07:36Z,11.650,19.650
doi:10.3389/frobt.2022.828732,Where Does It Belong? Autonomous Object Mapping in Open-World Settings,"Detecting changes such as moved, removed, or new objects is the essence for numerous indoor applications in robotics such as tidying-up, patrolling, and fetch/carry tasks. The problem is particularly challenging in open-world scenarios where novel objects may appear at any time. The main idea of this paper is to detect objects from partial 3D reconstructions of interesting areas in the environment. In our pipeline we first identify planes, consider clusters on top as objects, and compute their point-pair-features. They are used to match potential objects and categorize them robustly into static, moved, removed, and novel objects even in the presence of partial object reconstructions and clutter. Our approach dissolves heaps of objects without specific object knowledge, but only with the knowledge acquired from change detection. The evaluation is performed on real-world data that includes",2022,Frontiers in Robotics and AI,Edith Langer; Timothy Patten; Markus Vincze,10.3389/frobt.2022.828732,,https://doi.org/10.3389/frobt.2022.828732,crossref,causal robot world model,concept,architecture,,2,robot world model; causal robot world model,2026-06-12T15:07:36Z,16.599,19.599
doi:10.1007/s10514-024-10172-6,Planning under uncertainty for safe robot exploration using Gaussian process prediction,"Abstract The exploration of new environments is a crucial challenge for mobile robots. This task becomes even more complex with the added requirement of ensuring safety. Here, safety refers to the robot staying in regions where the values of certain environmental conditions (such as terrain steepness or radiation levels) are within a predefined threshold. We consider two types of safe exploration problems. First, the robot has a map of its workspace, but the values of the environmental features relevant to safety are unknown beforehand and must be explored. Second, both the map and the environmental features are unknown, and the robot must build a map whilst remaining safe. Our proposed framework uses a Gaussian process to predict the value of the environmental features in unvisited regions. We then build a Markov decision process that integrates the Gaussian process predictions with the",2024,Autonomous Robots,Alex Stephens; Matthew Budd; Michal Staniaszek; Benoit Casseau; Paul Duckworth; Maurice Fallon; Nick Hawes; Bruno Lacerda,10.1007/s10514-024-10172-6,,https://doi.org/10.1007/s10514-024-10172-6,crossref,robot world model failure planning,hostile,failure,,4,robot world model; robot world model failure,2026-06-12T15:07:36Z,14.555,19.555
doi:10.1016/j.probengmech.2013.02.001,Uncertainty in fatigue loading: Consequences on statistical evaluation of reliability in service,,2013,Probabilistic Engineering Mechanics,D.S. Paolino; G. Chiandussi; G. Belingardi,10.1016/j.probengmech.2013.02.001,,https://doi.org/10.1016/j.probengmech.2013.02.001,crossref,probabilistic robotics,anti_myopia,anti_thesis,,1,probabilistic robotics,2026-06-12T15:07:36Z,14.547,19.547
arxiv:2603.06987v1,Foundational World Models Accurately Detect Bimanual Manipulator Failures,"Deploying visuomotor robots at scale is challenging due to the potential for anomalous failures to degrade performance, cause damage, or endanger human life. Bimanual manipulators are no exception; these robots have vast state spaces comprised of high-dimensional images and proprioceptive signals. Explicitly defining failure modes within such state spaces is infeasible. In this work, we overcome these challenges by training a probabilistic, history informed, world model within the compressed latent space of a pretrained vision foundation model (NVIDIA's Cosmos Tokenizer). The model outputs uncertainty estimates alongside its predictions that serve as non-conformity scores within a conformal prediction framework. We use these scores to develop a runtime monitor, correlating periods of high uncertainty with anomalous failures. To test these methods, we use the simulated Push-T environment ",2026,arXiv,Isaac R. Ward; Michelle Ho; Houjun Liu; Aaron Feldman; Joseph Vincent; Liam Kruse; Sean Cheong; Duncan Eddy; Mykel J. Kochenderfer; Mac Schwager,,2603.06987v1,http://arxiv.org/abs/2603.06987v1,arxiv,robot foundation model failure mode,hostile,failure,,,robot foundation model; failure detection; failure mode; benchmark; out of distribution,2026-06-12T14:45:03Z,12.500,19.500
doi:10.33774/coe-2025-xkwl5,Controlling Large Language Model Hallucination Based on Agent AI with LangGraph,"As Large Language Models (LLMs) become integral to Natural Language Processing (NLP) applications, their tendency to generate hallucinations — outputs misaligned with input data or real-world facts — presents a significant challenge. This paper introduces a novel approach leveraging Agent AI within the LangGraph system to systematically detect and mitigate LLM hallucinations. The framework categorizes hallucinations into three distinct types: Hallucination Knowledge Positive (HK+), Hallucination Knowledge Negative (HK-), and normal responses. HK+ represents errors where the model has relevant knowledge but provides incorrect answers, while HK- denotes hallucinations arising from insufficient knowledge. Normal responses are accurate outputs requiring no intervention. The proposed method employs corrective Retrieval-Augmented Generation (RAG) to address HK- cases by supplementing missing k",,,Jialin Wang; Zhihua Duan,10.33774/coe-2025-xkwl5,,https://doi.org/10.33774/coe-2025-xkwl5,crossref,large language model limitation robot planning,anti_myopia,anti_thesis,,4,limitation; deployment; large language model limitation robot planning,2026-06-12T15:07:36Z,12.405,19.405
doi:10.3390/info16100894,"Large Language Model Agents for Biomedicine: A Comprehensive Review of Methods, Evaluations, Challenges, and Future Directions","Large language model (LLM)-based agents are rapidly emerging as transformative tools across biomedical research and clinical applications. By integrating reasoning, planning, memory, and tool use capabilities, these agents go beyond static language models to operate autonomously or collaboratively within complex healthcare settings. This review provides a comprehensive survey of biomedical LLM agents, spanning their core system architectures, enabling methodologies, and real-world use cases such as clinical decision making, biomedical research automation, and patient simulation. We further examine emerging benchmarks designed to evaluate agent performance under dynamic, interactive, and multimodal conditions. In addition, we systematically analyze key challenges, including hallucinations, interpretability, tool reliability, data bias, and regulatory gaps, and discuss corresponding mitiga",2025,Information,Xiaoran Xu; Ravi Sankar,10.3390/info16100894,,https://doi.org/10.3390/info16100894,crossref,large language model limitation robot planning,anti_myopia,anti_thesis,,7,continual learning; limitation; benchmark; large language model limitation robot planning,2026-06-12T15:07:36Z,12.290,19.290
arxiv:2601.07821v1,Failure-Aware RL: Reliable Offline-to-Online Reinforcement Learning with Self-Recovery for Real-World Manipulation,"Post-training algorithms based on deep reinforcement learning can push the limits of robotic models for specific objectives, such as generalizability, accuracy, and robustness. However, Intervention-requiring Failures (IR Failures) (e.g., a robot spilling water or breaking fragile glass) during real-world exploration happen inevitably, hindering the practical deployment of such a paradigm. To tackle this, we introduce Failure-Aware Offline-to-Online Reinforcement Learning (FARL), a new paradigm minimizing failures during real-world reinforcement learning. We create FailureBench, a benchmark that incorporates common failure scenarios requiring human intervention, and propose an algorithm that integrates a world-model-based safety critic and a recovery policy trained offline to prevent failures during online exploration. Extensive simulation and real-world experiments demonstrate the effec",2026,arXiv,Huanyu Li; Kun Lei; Sheng Zang; Kaizhe Hu; Yongyuan Liang; Bo An; Xiaoli Li; Huazhe Xu,,2601.07821v1,http://arxiv.org/abs/2601.07821v1,arxiv,robot foundation model failure mode,hostile,failure,,,robot foundation model; failure mode; benchmark; generalization; robustness; deployment,2026-06-12T14:45:03Z,10.150,19.150
doi:10.1016/j.probengmech.2024.103618,Uncertainty quantification for viscoelastic composite materials using time-separated stochastic mechanics,,2024,Probabilistic Engineering Mechanics,Hendrik Geisler; Philipp Junker,10.1016/j.probengmech.2024.103618,,https://doi.org/10.1016/j.probengmech.2024.103618,crossref,probabilistic robotics,anti_myopia,anti_thesis,,7,probabilistic robotics,2026-06-12T15:07:36Z,15.040,19.040
doi:10.1007/s10846-026-02403-y,STL-Based Motion Planning and Uncertainty-Aware Risk Analysis for Human-Robot Collaboration with a Multi-Rotor Aerial Vehicle,"Abstract This paper presents a motion planning and risk analysis framework for enhancing human-robot collaboration with a Multi-Rotor Aerial Vehicle. The proposed method employs Signal Temporal Logic to encode key mission objectives, including safety, temporal requirements, and human preferences, with particular emphasis on ergonomics and comfort. An optimization-based planner generates dynamically feasible trajectories while explicitly accounting for the vehicle’s nonlinear dynamics and actuation constraints. To address the resulting non-convex and non-smooth optimization problem, smooth robustness approximations and gradient-based techniques are adopted. In addition, an uncertainty-aware risk analysis is introduced to quantify the likelihood of specification violations under human-pose uncertainty. A robustness-aware event-triggered replanning strategy further enables online recovery f",2026,Journal of Intelligent & Robotic Systems,Giuseppe Silano; Amr Afifi; Martin Saska; Antonio Franchi,10.1007/s10846-026-02403-y,,https://doi.org/10.1007/s10846-026-02403-y,crossref,robot world model failure planning,hostile,failure,,,robot world model; motion planning; robustness; robot world model failure,2026-06-12T15:07:36Z,11.950,18.950
arxiv:2504.01957v2,Toward Real-world BEV Perception: Depth Uncertainty Estimation via Gaussian Splatting,"Bird's-eye view (BEV) perception has gained significant attention because it provides a unified representation to fuse multiple view images and enables a wide range of down-stream autonomous driving tasks, such as forecasting and planning. Recent state-of-the-art models utilize projection-based methods which formulate BEV perception as query learning to bypass explicit depth estimation. While we observe promising advancements in this paradigm, they still fall short of real-world applications because of the lack of uncertainty modeling and expensive computational requirement. In this work, we introduce GaussianLSS, a novel uncertainty-aware BEV perception framework that revisits unprojection-based methods, specifically the Lift-Splat-Shoot (LSS) paradigm, and enhances them with depth un-certainty modeling. GaussianLSS represents spatial dispersion by learning a soft depth mean and computi",2025,arXiv,Shu-Wei Lu; Yi-Hsuan Tsai; Yi-Ting Chen,,2504.01957v2,http://arxiv.org/abs/2504.01957v2,arxiv,Gaussian splatting robot perception,concept,architecture,,,Gaussian splatting robot perception,2026-06-12T14:45:03Z,16.850,18.850
doi:10.1002/rob.22519,Developing a Climbing Robot for Stay Cable Maintenance With Security and Rescue Mechanisms,"ABSTRACT The significance of climbing robotic systems for cable maintenance is escalating in both academic research and real‐world applications. As these systems are poised for real‐world deployment, it is imperative to develop security and rescue mechanisms that ensure robots' intrinsic safety and robustness in dealing with uncertainty factors. This study presents a novel cable climbing robot designed with a climbing platform, a robotic manipulator integrated with specialized maintenance tools, and a gripper to withstand dynamic loads and impacts from maintenance operations. In addition, we propose the variable‐damping safe‐landing mechanism, the rescue mechanism, and the fusible gripper mechanism to counteract substantial disturbances in worst‐case scenarios. Extensive experiments have been conducted to evaluate the proposed robot and its security and rescue mechanisms. The cable climb",2025,Journal of Field Robotics,Zhenliang Zheng; Chao Wang; Xiaoli Hu; Lun Zhang; Wenchao Zhang; Yongyuan Xu; Pengfei Liu; Xufang Pang; Tin Lun Lam; Ning Ding,10.1002/rob.22519,,https://doi.org/10.1002/rob.22519,crossref,neural radiance field robotics,concept,architecture,,10,neural radiance field robotics; robustness; deployment,2026-06-12T15:07:36Z,14.849,18.849
arxiv:2409.12045v2,Handling Long-Term Safety and Uncertainty in Safe Reinforcement Learning,"Safety is one of the key issues preventing the deployment of reinforcement learning techniques in real-world robots. While most approaches in the Safe Reinforcement Learning area do not require prior knowledge of constraints and robot kinematics and rely solely on data, it is often difficult to deploy them in complex real-world settings. Instead, model-based approaches that incorporate prior knowledge of the constraints and dynamics into the learning framework have proven capable of deploying the learning algorithm directly on the real robot. Unfortunately, while an approximated model of the robot dynamics is often available, the safety constraints are task-specific and hard to obtain: they may be too complicated to encode analytically, too expensive to compute, or it may be difficult to envision a priori the long-term safety requirements. In this paper, we bridge this gap by extending t",2024,arXiv,Jonas Günster; Puze Liu; Jan Peters; Davide Tateo,,2409.12045v2,http://arxiv.org/abs/2409.12045v2,arxiv,energy based model robot learning,concept,ebm,,,safety constraint; deployment,2026-06-12T14:45:03Z,15.650,18.650
doi:10.1016/j.probengmech.2022.103370,Interval deep learning for computational mechanics problems under input uncertainty,,2022,Probabilistic Engineering Mechanics,David Betancourt; Rafi L. Muhanna,10.1016/j.probengmech.2022.103370,,https://doi.org/10.1016/j.probengmech.2022.103370,crossref,probabilistic robotics,anti_myopia,anti_thesis,,7,probabilistic robotics,2026-06-12T15:07:36Z,14.640,18.640
doi:10.1111/joms.12897,Towards Stronger Causal Claims in Management Research: Causal Triangulation Instead of Causal Identification,"Abstract This article addresses widespread concerns about the reliability and strength of many causal claims made in management research. We first critically review the three prevalent forms of theorizing used to identify causal relationships in this field, i.e., propositional, configurational, and process approaches to causation. Highlighting the strengths and limitations of these approaches, we show that while no single approach is sufficient by itself as the basis for robust causal claims, researchers can nonetheless enhance and strengthen claims significantly by combining approaches and thus subjecting them to multiple criteria for drawing robust inferences. We emphasize the risks of continuing with narrow monolithic approaches, using examples of weak claims to show how these could have been strengthened (or abandoned) if the researchers had followed our proposed model of causal tria",2023,Journal of Management Studies,Joep Cornelissen; Mariëtte Kaandorp,10.1111/joms.12897,,https://doi.org/10.1111/joms.12897,crossref,causal robot world model,concept,architecture,,29,robot world model; causal robot world model; limitation,2026-06-12T15:07:36Z,16.601,18.601
doi:10.1146/annurev-control-062322-100607,An Overview of Soft Robotics,"Soft robots’ flexibility and compliance give them the potential to outperform traditional rigid-bodied robots while performing multiple tasks in unexpectedly changing environments and conditions. However, soft robots are yet to reveal their full potential; nature is still far more advanced in several areas, such as locomotion and manipulation. To understand what limits their performance and hinders their transition from laboratory to real-world conditions, future studies should focus on understanding the principles behind the design and operation of soft robots. Such studies should also consider the major challenges with regard to complex materials, accurate modeling, advanced control, and intelligent behaviors. As a starting point for such studies, this review provides a current overview of the field by examining the working mechanisms of advanced actuation and sensing modalities, model",2023,"Annual Review of Control, Robotics, and Autonomous Systems",Oncay Yasa; Yasunori Toshimitsu; Mike Y. Michelis; Lewis S. Jones; Miriam Filippi; Thomas Buchner; Robert K. Katzschmann,10.1146/annurev-control-062322-100607,,https://doi.org/10.1146/annurev-control-062322-100607,crossref,classical control robotics,anti_myopia,anti_thesis,,237,classical control robotics,2026-06-12T15:07:36Z,13.586,18.586
doi:10.1049/csy2.70042,Hybrid‐Linear Inverted Pendulum Gait Planning With H ‐Infinity Uncertainty Compensation for Robust Biped Robot Walking,"ABSTRACT Reduced‐order models (ROMs) are widely employed in biped robot control due to their computational efficiency, but their simplified representations often neglect critical nonlinear dynamics, leading to limited robustness under real‐world disturbances. To overcome this limitation, this paper introduces a robust hierarchical control framework that explicitly compensates for unmodelled dynamics and provides theoretical stability guarantees. The proposed architecture consists of two layers. At the high level, a hybrid‐linear inverted pendulum (HLIP) model generates real‐time gait commands, whereas an feedback law accounts for dynamic uncertainties introduced by model simplification. A Lyapunov‐based analysis is used to rigorously establish the stability of each planned foothold. At the low level, a whole‐body controller tracks both swing‐leg and centre‐of‐mass trajectories by solving",2026,IET Cyber-Systems and Robotics,Jia Li; Yan Liu,10.1049/csy2.70042,,https://doi.org/10.1049/csy2.70042,crossref,hybrid dynamical systems robotics,anti_myopia,anti_thesis,,,limitation; robustness; hybrid dynamical systems robotics,2026-06-12T15:07:36Z,11.550,18.550
