uid,title,abstract,year,venue,authors,doi,arxiv_id,url,source,query,query_role,family,advisor_seed,citation_count,matched_terms,retrieved_at,relevance_score,hostile_score
doi:10.3390/app16063051,An Investigation into Uncertainty Quantification of Shallow Foundation Failure Mechanisms in Horizontally Stratified Layered Soil Strata,"In light of the evolution of computer science and computational mechanics, an uncertainty analysis of engineering systems has become increasingly feasible. In this paper, the failure of shallow foundations in layered soil continua is examined. It is shown that Gaussian input distributions lead to approximately Gaussian output response distributions even in the presence of an extensive nonlinear relationship between them. Soil configurations that provide larger average values and higher output variability in terms of bearing capacity force are those in which cohesive, stronger soils such as clays exist in the upper layers. Configurations with sandy soils in the upper layers, in several cases, provide greater average values of maximum displacements, rotations, and output variation. In this paper, the probabilities of the Meyerhof spline onset point are also estimated. Therefore, the propos",2026,Applied Sciences,Ambrosios-Antonios Savvides,10.3390/app16063051,,https://doi.org/10.3390/app16063051,crossref,robot foundation model failure mode,hostile,failure,,,robot foundation model; failure mode,2026-06-12T15:07:36Z,22.000,27.000
arxiv:2602.03973v1,VLS: Steering Pretrained Robot Policies via Vision-Language Models,"Why do pretrained diffusion or flow-matching policies fail when the same task is performed near an obstacle, on a shifted support surface, or amid mild clutter? Such failures rarely reflect missing motor skills; instead, they expose a limitation of imitation learning under train-test shifts, where action generation is tightly coupled to training-specific spatial configurations and task specifications. Retraining or fine-tuning to address these failures is costly and conceptually misaligned, as the required behaviors already exist but cannot be selectively adapted at test time. We propose Vision-Language Steering (VLS), a training-free framework for inference-time adaptation of frozen generative robot policies. VLS treats adaptation as an inference-time control problem, steering the sampling process of a pretrained diffusion or flow-matching policy in response to out-of-distribution obser",2026,arXiv,Shuo Liu; Ishneet Sukhvinder Singh; Yiqing Xu; Jiafei Duan; Ranjay Krishna,,2602.03973v1,http://arxiv.org/abs/2602.03973v1,arxiv,vision language action model limitation robotics,hostile,failure,,,vision language action model; flow matching policy; imitation learning; limitation; out of distribution; deployment; real world evaluation,2026-06-12T14:45:03Z,16.200,25.200
doi:10.3390/s26103140,Uncertainty-Calibrated Safety Gating for Vision–Language– Action Manipulation Under Domain Shift: Reliability Gains and Intervention–Efficiency Trade-Offs,"Vision–Language–Action (VLA) policies promise flexible long-horizon manipulation, but deployment under domain shift requires both reliable uncertainty estimates and a workable runtime-assurance policy. We study a model-agnostic uncertainty-calibrated safety-gating wrapper that estimates online failure risk and routes control among policy execution, pause-and-reobserve, and a fallback planner. Using a cleaned and consistently aggregated benchmark pipeline, we evaluate two long-horizon manipulation tasks in NVIDIA Isaac Sim 5.0 under lighting, texture, occlusion, sensor, and combined shifts. Relative to an ungated VLA baseline, calibrated gating improves mean shifted success from 57.5% to 77.2% and reduces aggregate expected calibration error from 0.303 to 0.100. The largest success gains occur under occlusion and combined shift, including improvements from 48.3% to 85.2% on the drawer tas",2026,Sensors,Atef M. Ghaleb; Ali S. Allahloh; Sobhi Mejjaouli; Mohammed A. H. Ali; Adel Al-Shayea,10.3390/s26103140,,https://doi.org/10.3390/s26103140,crossref,vision language action model limitation robotics,hostile,failure,,,vision language action model; limitation; benchmark; robustness; occlusion; distribution shift; deployment; long horizon,2026-06-12T15:07:36Z,14.950,23.950
arxiv:2112.05299v1,Zero-Shot Uncertainty-Aware Deployment of Simulation Trained Policies on Real-World Robots,"While deep reinforcement learning (RL) agents have demonstrated incredible potential in attaining dexterous behaviours for robotics, they tend to make errors when deployed in the real world due to mismatches between the training and execution environments. In contrast, the classical robotics community have developed a range of controllers that can safely operate across most states in the real world given their explicit derivation. These controllers however lack the dexterity required for complex tasks given limitations in analytical modelling and approximations. In this paper, we propose Bayesian Controller Fusion (BCF), a novel uncertainty-aware deployment strategy that combines the strengths of deep RL policies and traditional handcrafted controllers. In this framework, we can perform zero-shot sim-to-real transfer, where our uncertainty based formulation allows the robot to reliably a",2021,arXiv,Krishan Rana; Vibhavari Dasagi; Jesse Haviland; Ben Talbot; MIchael Milford; Niko Sünderhauf,,2112.05299v1,http://arxiv.org/abs/2112.05299v1,arxiv,real world robot learning deployment,concept,deployment,,,sim to real transfer; limitation; out of distribution; deployment,2026-06-12T15:07:36Z,16.050,23.050
arxiv:2107.09822v3,Bayesian Controller Fusion: Leveraging Control Priors in Deep Reinforcement Learning for Robotics,"We present Bayesian Controller Fusion (BCF): a hybrid control strategy that combines the strengths of traditional hand-crafted controllers and model-free deep reinforcement learning (RL). BCF thrives in the robotics domain, where reliable but suboptimal control priors exist for many tasks, but RL from scratch remains unsafe and data-inefficient. By fusing uncertainty-aware distributional outputs from each system, BCF arbitrates control between them, exploiting their respective strengths. We study BCF on two real-world robotics tasks involving navigation in a vast and long-horizon environment, and a complex reaching task that involves manipulability maximisation. For both these domains, simple handcrafted controllers exist that can solve the task at hand in a risk-averse manner but do not necessarily exhibit the optimal solution given limitations in analytical modelling, controller miscal",2021,arXiv,Krishan Rana; Vibhavari Dasagi; Jesse Haviland; Ben Talbot; Michael Milford; Niko Sünderhauf,,2107.09822v3,http://arxiv.org/abs/2107.09822v3,arxiv,classical control robotics,anti_myopia,anti_thesis,,,limitation; out of distribution; deployment; long horizon; classical control robotics,2026-06-12T15:07:36Z,13.000,23.000
arxiv:2601.21282v1,WorldBench: Disambiguating Physics for Diagnostic Evaluation of World Models,"Recent advances in generative foundational models, often termed ""world models,"" have propelled interest in applying them to critical tasks like robotic planning and autonomous system training. For reliable deployment, these models must exhibit high physical fidelity, accurately simulating real-world dynamics. Existing physics-based video benchmarks, however, suffer from entanglement, where a single test simultaneously evaluates multiple physical laws and concepts, fundamentally limiting their diagnostic capability. We introduce WorldBench, a novel video-based benchmark specifically designed for concept-specific, disentangled evaluation, allowing us to rigorously isolate and assess understanding of a single physical concept or law at a time. To make WorldBench comprehensive, we design benchmarks at two different levels: 1) an evaluation of intuitive physical understanding with concepts su",2026,arXiv,Rishi Upadhyay; Howard Zhang; Jim Solomon; Ayush Agrawal; Pranay Boreddy; Shruti Satya Narayana; Yunhao Ba; Alex Wong; Celso M de Melo; Achuta Kadambi,,2601.21282v1,http://arxiv.org/abs/2601.21282v1,arxiv,robot world model failure planning,hostile,failure,,,robot world model; benchmark; deployment; robot world model failure,2026-06-12T14:45:03Z,14.850,22.850
arxiv:2604.16677v1,ReconVLA: An Uncertainty-Guided and Failure-Aware Vision-Language-Action Framework for Robotic Control,"Vision-language-action (VLA) models have emerged as generalist robotic controllers capable of mapping visual observations and natural language instructions to continuous action sequences. However, VLAs provide no calibrated measure of confidence in their action predictions, thus limiting their reliability in real-world settings where uncertainty and failures must be anticipated. To address this problem we introduce ReconVLA, a reliable conformal model that produces uncertainty-guided and failure-aware control signals. Concretely, our approach applies conformal prediction directly to the action token outputs of pretrained VLA policies, yielding calibrated uncertainty estimates that correlate with execution quality and task success. Furthermore, we extend conformal prediction to the robot state space to detect outliers or unsafe states before failures occur, providing a simple yet effectiv",2026,arXiv,Lingling Chen; Zongyao Lyu; William J. Beksi,,2604.16677v1,http://arxiv.org/abs/2604.16677v1,arxiv,vision language action model failure,anti_myopia,anti_thesis,,,vision language action model; failure detection; vision language action model failure,2026-06-12T15:07:36Z,16.800,22.800
doi:10.61453/jods.v20260103,Benchmarking Robust Machine Learning Models Under Data Imperfections in Real-World Data Science Scenarios,"Machine learning systems deployed in real-world environments frequently encounter data imperfections such as noise, missing values, class imbalance, and distribution shifts. Despite substantial progress in model development, most evaluation protocols rely on clean benchmark datasets, creating a gap between laboratory performance and operational reliability. Existing robustness studies often focus on isolated perturbation types or single model families, lacking a unified benchmarking framework. This study proposes a structured and reproducible benchmarking methodology to systematically evaluate model robustness under controlled data degradation scenarios. Multiple classical machine learning algorithms and deep learning models were assessed across diverse benchmark datasets. Controlled perturbations—including feature noise, label corruption, missingness mechanisms, imbalance ratios, and co",2026,Journal of Data Science,Marlindawati .; Muhammad Azhar; Esha Sabir,10.61453/jods.v20260103,,https://doi.org/10.61453/jods.v20260103,crossref,real world robot learning deployment,concept,deployment,,,benchmark; robustness; distribution shift; deployment,2026-06-12T15:07:36Z,16.000,22.000
arxiv:2603.11400v1,Deployment-Time Reliability of Learned Robot Policies,"Recent advances in learning-based robot manipulation have produced policies with remarkable capabilities. Yet, reliability at deployment remains a fundamental barrier to real-world use, where distribution shift, compounding errors, and complex task dependencies collectively undermine system performance. This dissertation investigates how the reliability of learned robot policies can be improved at deployment time through mechanisms that operate around them. We develop three complementary classes of deployment-time mechanisms. First, we introduce runtime monitoring methods that detect impending failures by identifying inconsistencies in closed-loop policy behavior and deviations in task progress, without requiring failure data or task-specific supervision. Second, we propose a data-centric framework for policy interpretability that traces deployment-time successes and failures to influent",2026,arXiv,Christopher Agia,,2603.11400v1,http://arxiv.org/abs/2603.11400v1,arxiv,test time adaptation robot policy,concept,adaptation,,,robot manipulation; test time adaptation; distribution shift; deployment; long horizon,2026-06-12T14:45:03Z,18.550,21.550
arxiv:2309.08052v1,A Bayesian approach to breaking things: efficiently predicting and repairing failure modes via sampling,"Before autonomous systems can be deployed in safety-critical applications, we must be able to understand and verify the safety of these systems. For cases where the risk or cost of real-world testing is prohibitive, we propose a simulation-based framework for a) predicting ways in which an autonomous system is likely to fail and b) automatically adjusting the system's design to preemptively mitigate those failures. We frame this problem through the lens of approximate Bayesian inference and use differentiable simulation for efficient failure case prediction and repair. We apply our approach on a range of robotics and control problems, including optimizing search patterns for robot swarms and reducing the severity of outages in power transmission networks. Compared to optimization-based falsification techniques, our method predicts a more diverse, representative set of failure modes, and ",2023,arXiv,Charles Dawson; Chuchu Fan,,2309.08052v1,http://arxiv.org/abs/2309.08052v1,arxiv,robot foundation model failure mode,hostile,failure,,,robot foundation model; failure mode,2026-06-12T14:45:03Z,16.450,21.450
doi:10.1016/j.probengmech.2025.103755,Reliability-based design optimization incorporating extended Optimal Uncertainty Quantification,,2025,Probabilistic Engineering Mechanics,Niklas Miska; Daniel Balzani,10.1016/j.probengmech.2025.103755,,https://doi.org/10.1016/j.probengmech.2025.103755,crossref,probabilistic robotics,anti_myopia,anti_thesis,,8,probabilistic robotics,2026-06-12T15:07:36Z,17.299,21.299
doi:10.3390/sym18030394,PI-VLA: Adaptive Symmetry-Aware Decision-Making for Long-Horizon Vision–Language–Action Manipulation,"Vision–language–action (VLA) models often suffer from limited robustness in long-horizon manipulation tasks—where robots must execute extended sequences of actions over multiple time steps to achieve complex goals—due to their inability to explicitly exploit structural symmetries and to react adaptively when such symmetries are violated by environmental uncertainty. To address this limitation, this paper proposes PI-VLA, a symmetry-aware predictive and interactive VLA framework for robust robotic manipulation. PI-VLA is built upon three key symmetry-driven principles. First, a Cognitive–Motor Synergy (CMS) module jointly generates discrete and continuous action chunks together with predictive world-model features in a single forward pass, enforcing cross-modal action consistency as an implicit symmetry constraint across heterogeneous action representations. Second, a unified training obj",2026,Symmetry,Yina Jian; Di Tian; Xuan-Jing Chen; Zhen-Yuan Wei; Chen-Wei Liang; Mu-Jiang-Shan Wang,10.3390/sym18030394,,https://doi.org/10.3390/sym18030394,crossref,vision language action model limitation robotics,hostile,failure,,2,vision language action model; imitation learning; limitation; benchmark; robustness; ablation; long horizon,2026-06-12T15:07:36Z,12.199,21.199
doi:10.1016/j.probengmech.2025.103768,Time-dependent reliability index for continuum structures against field uncertainty based on non-probabilistic bounded field model,,2025,Probabilistic Engineering Mechanics,Junjie Zhan; Jiangpeng Li; Yutong Liu,10.1016/j.probengmech.2025.103768,,https://doi.org/10.1016/j.probengmech.2025.103768,crossref,probabilistic robotics,anti_myopia,anti_thesis,,5,probabilistic robotics,2026-06-12T15:07:36Z,17.096,21.096
doi:10.1016/j.probengmech.2023.103419,Physics-integrated deep learning for uncertainty quantification and reliability estimation of nonlinear dynamical systems,,2023,Probabilistic Engineering Mechanics,Udbhav Tripathi; Shailesh Garg; Rajdip Nayek; Souvik Chakraborty,10.1016/j.probengmech.2023.103419,,https://doi.org/10.1016/j.probengmech.2023.103419,crossref,probabilistic robotics,anti_myopia,anti_thesis,,10,probabilistic robotics,2026-06-12T15:07:36Z,16.999,20.999
doi:10.1016/j.probengmech.2024.103631,Quantile-based sequential optimization and reliability assessment method under random and interval hybrid uncertainty,,2024,Probabilistic Engineering Mechanics,Xinglin Li; Zhenzhou Lu; Ning Wei,10.1016/j.probengmech.2024.103631,,https://doi.org/10.1016/j.probengmech.2024.103631,crossref,probabilistic robotics,anti_myopia,anti_thesis,,5,probabilistic robotics,2026-06-12T15:07:36Z,16.896,20.896
doi:10.1002/qre.3429,Reliability assessment of two‐level balanced systems with common bus performance sharing subjected to epistemic uncertainty,"Abstract Two‐level balanced systems with common bus performance sharing (TLBS‐CBPS), represented by power battery systems, play an important role in various industries. Where the two‐level balance refers to when the system is unbalanced, redistributing performance between modules using a common bus for the intermodule balance, followed by the in‐module component performance redistribution to achieve global balance, that is, the performance differences among all components are within the balance degree threshold. However, the component performance has epistemic uncertainty due to measurement limitations, and the distance‐dependent transmission loss incurs during the performance redistribution. These problems make the reliability evaluation of TLBS‐CBPS challenging. To address these issues, a reliability evaluation method for TLBS‐CBPS is proposed by considering two‐level balance, epistemi",2023,Quality and Reliability Engineering International,Tianzi Tian; Jun Yang; Ning Wang,10.1002/qre.3429,,https://doi.org/10.1002/qre.3429,openalex,energy based transformer robot policy,concept,ebm_transformer,,20,energy based transformer robot policy; limitation,2026-06-12T18:05:07Z,17.822,20.822
doi:10.1016/j.probengmech.2023.103538,Data-driven polynomial chaos-interval metamodel for dynamics and reliability analysis under hybrid uncertainty,,2023,Probabilistic Engineering Mechanics,Xiang Guo; Yanfei Jin,10.1016/j.probengmech.2023.103538,,https://doi.org/10.1016/j.probengmech.2023.103538,crossref,probabilistic robotics,anti_myopia,anti_thesis,,6,probabilistic robotics,2026-06-12T15:07:36Z,16.773,20.773
doi:10.1109/robot.1987.1087941,Mechanics of coordinative manipulation by multiple robotic mechanisms,"This paper discusses the mechanics of coordinative manipulation by multiple robot manipulators or a multifingered robot hand. The coordinative manipulation problem is divided into two phases. One is determining the resultant force by multiple robotic mechanisms, and the other is determining the internal force between them. The resultant force is used for the manipulation of an object subjected by the external forces or the environmental constraints. The internal force is used for adapting the robotic mechanisms to uncertainty and variety of the static friction. A dynamic coordinative control scheme is proposed for determining the resultant forces. The optimal internal force is defined as the internal force that yields the minimal norm force satisfying static frictional constraints. The optimal internal force promotes the stability of prehension, while the conventional method sometimes re",2005,,Yoshihiko Nakamura; Kiyoshi Nagai; T. Yoshikawa,10.1109/robot.1987.1087941,,https://doi.org/10.1109/robot.1987.1087941,openalex,robotics,concept,openalex_bulk_robotics,,230,robot hand,2026-06-12T18:57:17Z,19.771,20.771
doi:10.1016/j.probengmech.2011.08.007,"A comparison of deterministic, reliability-based and risk-based structural optimization under uncertainty",,2012,Probabilistic Engineering Mechanics,André Teófilo Beck; Wellison José de Santana Gomes,10.1016/j.probengmech.2011.08.007,,https://doi.org/10.1016/j.probengmech.2011.08.007,crossref,probabilistic robotics,anti_myopia,anti_thesis,,141,probabilistic robotics,2026-06-12T15:07:36Z,16.678,20.678
doi:10.1016/j.probengmech.2023.103552,Time-dependent reliability analysis of planar mechanisms considering truncated random variables and joint clearances,,2024,Probabilistic Engineering Mechanics,Yufan Cheng; Xinchen Zhuang; Tianxiang Yu,10.1016/j.probengmech.2023.103552,,https://doi.org/10.1016/j.probengmech.2023.103552,crossref,probabilistic robotics,anti_myopia,anti_thesis,,13,probabilistic robotics,2026-06-12T15:07:36Z,17.320,20.320
arxiv:2410.05562v1,FogROS2-PLR: Probabilistic Latency-Reliability For Cloud Robotics,"Cloud robotics enables robots to offload computationally intensive tasks to cloud servers for performance, cost, and ease of management. However, the network and cloud computing infrastructure are not designed for reliable timing guarantees, due to fluctuating Quality-of-Service (QoS). In this work, we formulate an impossibility triangle theorem for: Latency reliability, Singleton server, and Commodity hardware. The LSC theorem suggests that providing replicated servers with uncorrelated failures can exponentially reduce the probability of missing a deadline. We present FogROS2-Probabilistic Latency Reliability (PLR) that uses multiple independent network interfaces to send requests to replicated cloud servers and uses the first response back. We design routing mechanisms to discover, connect, and route through non-default network interfaces on robots. FogROS2-PLR optimizes the selection",2024,arXiv,Kaiyuan Chen; Nan Tian; Christian Juette; Tianshuang Qiu; Liu Ren; John Kubiatowicz; Ken Goldberg,,2410.05562v1,http://arxiv.org/abs/2410.05562v1,arxiv,non smooth mechanics robotics,anti_myopia,anti_thesis,,,latency; non smooth mechanics robotics,2026-06-12T15:07:36Z,16.250,20.250
doi:10.1016/j.probengmech.2024.103598,Time-dependent kinematic reliability of motion mechanisms with dynamic factors,,2024,Probabilistic Engineering Mechanics,Xinchen Zhuang; Xin Li; Chang Liu; Tianxiang Yu; Bifeng Song,10.1016/j.probengmech.2024.103598,,https://doi.org/10.1016/j.probengmech.2024.103598,crossref,probabilistic robotics,anti_myopia,anti_thesis,,11,probabilistic robotics,2026-06-12T15:07:36Z,17.242,20.242
doi:10.1177/02783649231167210,Bayesian controller fusion: Leveraging control priors in deep reinforcement learning for robotics,"We present Bayesian Controller Fusion (BCF): a hybrid control strategy that combines the strengths of traditional hand-crafted controllers and model-free deep reinforcement learning (RL). BCF thrives in the robotics domain, where reliable but suboptimal control priors exist for many tasks, but RL from scratch remains unsafe and data-inefficient. By fusing uncertainty-aware distributional outputs from each system, BCF arbitrates control between them, exploiting their respective strengths. We study BCF on two real-world robotics tasks involving navigation in a vast and long-horizon environment, and a complex reaching task that involves manipulability maximisation. For both these domains, simple handcrafted controllers exist that can solve the task at hand in a risk-averse manner but do not necessarily exhibit the optimal solution given limitations in analytical modelling, controller miscal",2023,The International Journal of Robotics Research,Krishan Rana; Vibhavari Dasagi; Jesse Haviland; Ben Talbot; Michael Milford; Niko Sünderhauf,10.1177/02783649231167210,,https://doi.org/10.1177/02783649231167210,crossref,model based reinforcement learning robotics,concept,architecture,,18,model based reinforcement learning robotics; limitation; out of distribution; deployment; long horizon,2026-06-12T15:07:36Z,14.072,20.072
doi:10.1002/qre.3486,Action reliability analysis under random‐interval hybrid uncertainty of chain conveyor based on adaptive intelligent extremum surrogate model,"Abstract The action responses of controlled mechanisms are often multiparametric, nonlinear, and uncertain. Complex dynamics and limited uncertain information pose difficulties for action reliability analysis. This paper develops an adaptive intelligent extremum surrogate model (AIESM) method for the action reliability under random‐interval hybrid uncertainty of a chain conveyor. First, a dynamic model of the chain conveyor is established, which considers the impact and frictional effects within the mechanical system, the regulating effects of the control system, and the external disturbances of the system. After that, a hybrid kernel extreme learning machine optimized by the sparrow search algorithm is employed as an intelligent surrogate model to construct the initial surrogate model from the hybrid uncertain variables to the limit state function (LSF) response and the extremum surroga",2024,Quality and Reliability Engineering International,Hao Wen; Baolin Hou; Yubin Lin; Xin Jin,10.1002/qre.3486,,https://doi.org/10.1002/qre.3486,crossref,adaptive world action model robot,concept,wam,,2,world action model; adaptive world action model,2026-06-12T15:07:36Z,18.999,19.999
